citation,document_number,end_page,html_url,pdf_url,type,subtype,publication_date,signing_date,start_page,title,disposition_notes,executive_order_number,not_received_for_publication
39 FR 30335, ,"","","",Presidential Document,Executive Order,08/22/1974,1974-08-21,"",The Honorable Rodger P. Davies,"",11801,""
39 FR 32111, ,"","","",Presidential Document,Executive Order,09/05/1974,1974-09-04,"","General Creighton W. Abrams, Chief of Staff, United States Army","",11802,""
39 FR 33297, ,"","","",Presidential Document,Executive Order,09/17/1974,1974-09-16,"","Establishing a Clemency Board to review certain convictions of persons under section 12 or 6 (j) of the Military Selective Service Act and certain discharges issued because of, and certain convictions for, violations of Article 85, 86, or 87 of the Uniform Code of Military Justice and to make recommendations for executive clemency with respect thereto","Amended by: EO 11837, January 30, 1975;      EO 11842, February 28, 1975; EO      11857, May 7, 1975; EO 11878, September      10, 1975 (Board terminated, functions transferred to Attorney General)
See: EO 11967, January 21, 1977",11803,""
39 FR 34641, ,"","","",Presidential Document,Executive Order,09/27/1974,1974-09-25,"","Amending Executive Order No. 11763 of January 17, 1974, to extend the life of the National Commission for the Observance of World Population Year","Amends: EO 11763, January 17, 1974",11806,""
39 FR 39427, ,"","","",Presidential Document,Executive Order,11/07/1974,1974-11-05,"",Delegating the United States Civil Service Commission as the agent to concur with agency determinations fixing the age limits within which original appointments may be made with respect to law enforcement officer and firefighters positions,"Amended by: EO 12107, December 28, 1978",11817,""
39 FR 39429, ,"","","",Presidential Document,Executive Order,11/07/1974,1974-11-05,"","Revoking Executive Order No. 11810 of September 30, 1974, and continuing in effect Executive Order No. 11533 of June 4, 1970, relating to the administration of export control","Continues in effect: EO 11533, June 4, 1970;      EO 11683, August 29, 1972; EO      11798, August 14, 1974
Revokes: EO 11810, September 30, 1974
Revoked by: EO 12002, July 7, 1977
See: EO 11940, September 30, 1976",11818,""
39 FR 40743, ,"","","",Presidential Document,Executive Order,11/20/1974,1974-11-16,"",Membership of the Energy Resources Council,"Amends: EO 11814, October 11, 1974
See: EO 11855, May 1, 1975",11819,""
39 FR 43529, ,"","","",Presidential Document,Executive Order,12/16/1974,1974-12-12,"",Abolishing the National Commission for Industrial Peace,"Revokes: EO 11710, April 4, 1973; EO      11729, July 12, 1973",11823,""
40 FR 751, ,"","","",Presidential Document,Executive Order,01/03/1975,1974-12-28,"",Exemption of Whitney Gillilland from mandatory retirement,"",11824,""
40 FR 1003, ,"","","",Presidential Document,Executive Order,01/06/1975,1974-12-31,"","Revocation of Executive orders pertaining to the regulation of the acquisition of, holding of, or other transactions in gold","Revokes:            EO 6073, March 10, 1933 (in part);            EO 6260, August 28, 1933;            EO 6359, October 25, 1933 (in part);            EO 6556, January 12, 1934;            EO 6560, January 15, 1934; EO 10289, September      17, 1951 (in part); EO 10896, November 29,      1960; EO 10905, January 14, 1961;      EO 11037, July 20, 1962",11825,""
40 FR 1004, ,"","","",Presidential Document,Executive Order,01/06/1975,1974-12-31,"",Exemption of Willard Deason from mandatory retirement,"",11826,""
40 FR 1217, ,"","","",Presidential Document,Executive Order,01/07/1975,1975-01-04,"",Continuance of certain Federal advisory committees,"Continuing various committees established by: EO      11126, November 1, 1963; EO 11145, March      7, 1964; EO 11183, October 3, 1964; EO      11287, June 28, 1966; EO 11342, April      10, 1967; EO 11415, June 24, 1968; EO      11472, May 29, 1969; EO 11562, September      25, 1970; EO 11583, February 24, 1971; EO      11625, October 13, 1971; EO 11667, April      19, 1972; EO 11753, December 20, 1973; EO      11776, March 28, 1974; EO 11807,      September 28, 1974
Amended by: EO 11915, May 10, 1976
Superseded by: EO 11948, December 20, 1976",11827,""
40 FR 1219, ,"","","",Presidential Document,Executive Order,01/07/1975,1975-01-04,"","Establishing a commission on CIA activities within the United
States","Amended by: EO 11848, March 29, 1975
EO 11848 of March 29, 1975 extended termination      date; report presented to the President on June 6, 1975 and Commission terminated      one month later.",11828,""
40 FR 1497, ,"","","",Presidential Document,Executive Order,01/08/1975,1975-01-06,"",The Hopi-Navajo Land Settlement Interagency Committee,"Amended by: EO 11853, April 17, 1975
Revoked by: EO 12379, August 17, 1982",11829,""
40 FR 2971, ,"","","",Presidential Document,Executive Order,01/17/1975,1975-01-15,"",Activation of the Energy Research and Development Administration and the Nuclear Regulatory Commission,"Revoked by: EO 12553, February 25, 1986",11834,""
40 FR 4895, ,"","","",Presidential Document,Executive Order,02/03/1975,1975-01-30,"","Amending Executive Order No. 11803 of September 16, 1974, to extend the period for application for Clemency Board review of certain convictions and military service discharges","Amends: EO 11803, September 16, 1974
Amended by: EO 11842, February 28, 1975
See: EO 11857, May 7, 1975",11837,""
40 FR 7353, ,"","","",Presidential Document,Executive Order,02/19/1975,1975-02-18,"",Waiver of certain provisions of law and limitations of authority,"Revoked by: EO 12001, June 29, 1977",11840,""
40 FR 8933, ,"","","",Presidential Document,Executive Order,03/04/1975,1975-02-28,"","Amending Executive Order No. 10973, relating to administration of foreign assistance and related functions, to provide for a Development Coordination Committee","Amends: EO 10973, November 3, 1961
Revoked by: EO 12163, September 29, 1979",11841,""
40 FR 13295, ,"","","",Presidential Document,Executive Order,03/26/1975,1975-03-24,"",Designation of beneficiary developing countries for the Generalized System of Preferences under the Trade Act of 1974,"Superseded by: EO 11888, November 24, 1975",11844,""
40 FR 14291, ,"","","",Presidential Document,Executive Order,03/31/1975,1975-03-27,"",Administration of the Trade Agreements Program,"Revokes: EO 11075, January 15, 1963; EO      11106, April 18, 1963; EO 11113,      June 13, 1963; EO 11789, June 25, 1974
Revokes in part: EO 11808, September      30, 1974
Amended by: EO 11894, January 3, 1976; EO      11947, November 8, 1976; EO 12102, November      17, 1978; EO 12163, September 29, 1979; EO      12188, January 2, 1980; EO 13277, November 19, 2002
See: EO 11907, March 1, 1976; Proc. 4510,      June 22, 1977; Proc. 4511, June 24, 1977; EO      12002, July 7, 1977; Proc. 4600, September 21, 1978; Proc. 4634, January      29, 1979; Proc. 4711, January 4, 1980; Proc. 4768, June 28, 1980; Proc.      4889, December 29, 1981",11846,""
40 FR 14568, ,"","","",Presidential Document,Executive Order,04/01/1975,1975-03-28,"",Exemption of Walter C. Sauer from mandatory retirement,"",11847,""
40 FR 14885, ,"","","",Presidential Document,Executive Order,04/03/1975,1975-03-29,"",Extending the reporting date for the Commission on CIA Activities Within the United States,"Amends: EO 11828, January 4, 1975",11848,""
40 FR 17239, ,"","","",Presidential Document,Executive Order,04/18/1975,1975-04-16,"",Creating an emergency board to investigate a dispute between the carriers represented by the National Railway Labor Conference and certain of their employees,"Revoked by: EO 12553, February 25, 1986",11852,""
40 FR 19423, ,"","","",Presidential Document,Executive Order,05/05/1975,1975-05-01,"",Membership of the Energy Resources Council,"Amends: EO 11814, October 11, 1974
See: EO 11819, November 16, 1974",11855,""
40 FR 20259, ,"","","",Presidential Document,Executive Order,05/09/1975,1975-05-07,"",Amending the Civil Service Rules to except certain positions from the career service,"",11856,""
40 FR 20261, ,"","","",Presidential Document,Executive Order,05/09/1975,1975-05-07,"","Amending Executive Order Nos. 11803, 11837, and 11842 to provide authority to increase the number of members of the Presidential Clemency Board","Amends: EO 11803, September 16, 1974
Amended by: EO 11878, September 10, 1975      (Termination of Clemency Board and transfer of functions to Attorney General)",11857,""
40 FR 20265, ,"","","",Presidential Document,Executive Order,05/09/1975,1975-05-07,"","Inspection of income, estate, and gift tax returns by the Senate Committee on Government Operations","",11859,""
40 FR 22121, ,"","","",Presidential Document,Executive Order,05/21/1975,1975-05-19,"",Establishing the President's Advisory Committee on Refugees,"Revoked by: EO 11948, December 20, 1976",11860,""
40 FR 22531, ,"","","",Presidential Document,Executive Order,05/23/1975,1975-05-21,"",Placing certain positions in levels IV and V of the Executive Schedule,"Supersedes: EO 11768, February 20,      1974
Amended by: EO 11864, June 13, 1975; EO      11872, July 21, 1975; EO 11877, September      2, 1975; EO 11885, October 15, 1975; EO      11893, December 31, 1975; EO 11898, January      14, 1976; EO 11908, March 18, 1976; EO      11927, July 22, 1976; EO 11976,      March 11, 1977; EO 11983, May 4, 1977;      EO 11986, May 20, 1977; EO      11995, June 8, 1977; EO 11999,      June 27, 1977; EO 12025, December 1,      1977; EO 12035, January 20, 1978; EO      12060, May 15, 1978; EO 12069, June 30,      1978
Revoked by: EO 12076, August 18, 1978",11861,""
40 FR 25431, ,"","","",Presidential Document,Executive Order,06/16/1975,1975-06-12,"",Withholding of city income or employment taxes by Federal agencies,"Revokes: EO 11833, January 13, 1975
Revoked by: EO 11968, January 31,      1977",11863,""
40 FR 25579, ,"","","",Presidential Document,Executive Order,06/17/1975,1975-06-13,"","Amending Executive Order No. 11861, placing certain positions in levels IV and V of the Executive Schedule","Amends: EO 11861, May 21, 1975
Superseded by: EO 11877, September 2, 1975",11864,""
40 FR 26253, ,"","","",Presidential Document,Executive Order,06/23/1975,1975-06-19,"",Delegating to the Administrator of General Services authority to issue joint funding regulations,"Amends: EO 11758, January 15, 1975
Supersedes: EO 11466, April 18, 1969;      EO 11784, May 30, 1974
Superseded in part by: EO 11893, December      31, 1975
Revoked by: EO 12553, February 25, 1986",11867,""
40 FR 26255, ,"","","",Presidential Document,Executive Order,06/23/1975,1975-06-19,"",President's Commission on Olympic Sports,"Amended by: EO 11873, July 21, 1975; EO      11936, September 8, 1976
Revoked by: EO 11948, December 20, 1976      (effective January 16, 1977)",11868,""
40 FR 26979, ,"","","",Presidential Document,Executive Order,06/26/1975,1975-06-24,"",Exemption of Arthur S. Flemming from mandatory retirement,"See: EO 11924, June 29, 1976; EO      12000, June 29, 1977",11869,""
40 FR 30611, ,"","","",Presidential Document,Executive Order,07/22/1975,1975-07-18,"",Environmental safeguards on activities for animal damage control on Federal lands,"Amends: EO 11643, February 8, 1972
Revoked by: EO 12342, January 27, 1982",11870,""
40 FR 31737, ,"","","",Presidential Document,Executive Order,07/29/1975,1975-07-25,"",Delegation of functions to the Director of the Office of Management and Budget,"",11874,""
40 FR 43197, ,"","","",Presidential Document,Executive Order,09/19/1975,1975-09-17,"",Delegating to the Secretary of Commerce functions relating to orders for the provision of chemicals or substances for treatment of water,"",11879,""
40 FR 47469, ,"","","",Presidential Document,Executive Order,10/09/1975,1975-10-07,"","Prescribing the official coat of arms, seal, and flag of the Vice President of the United States","Revokes: EO 10016, November 10, 1948",11884,""
40 FR 51411, ,"","","",Presidential Document,Executive Order,11/05/1975,1975-11-04,"",Amending the civil service rules to except certain positions from the career service,"",11887,""
40 FR 57775, ,"","","",Presidential Document,Executive Order,12/12/1975,1975-12-10,"","Amending Executive Order No. 10422, as amended, prescribing procedures for making available to the Secretary General of the United Nations certain information concerning United States citizens employed or being considered for employment on the Secretariat of the United Nations","Amends: EO 10422, January 9, 1953
Amended by: EO 12107, December 28, 1978",11890,""
41 FR 1040, ,"","","",Presidential Document,Executive Order,01/06/1976,1975-12-31,"",Transferring certain functions from the General Services Administration to the Office of Management and Budget,"Amends: EO 11861, May 21, 1975
Supersedes in part: EO 11717, May 9, 1973;      EO 11867, June 19, 1975
Amended by: EO 12076, August 18, 1978",11893,""
41 FR 1465, ,"","","",Presidential Document,Executive Order,01/08/1976,1976-01-05,"",Delegating authority of the President to designate individuals appointed by the President to receive training,"Supersedes: EO 11531, May 26, 1970
Amended by: EO 12107, December 28, 1978",11895,""
41 FR 2067, ,"","","",Presidential Document,Executive Order,01/14/1976,1976-01-13,"",Establishing the United States Sinai Support Mission,"Amended by: EO 12150, July 23, 1979; EO      12227, July 22, 1980; EO 12357, April      6, 1982
Revoked by: EO 12553, February 25, 1986",11896,""
41 FR 2071, ,"","","",Presidential Document,Executive Order,01/14/1976,1976-01-13,"",Amending Executive Order No. 11157 as it relates to special pay while on sea duty or duty at certain places,"Amends: EO 11157, June 22, 1964",11897,""
41 FR 3459, ,"","","",Presidential Document,Executive Order,01/23/1976,1976-01-22,"",Providing for the protection of certain civil service employment rights of Federal personnel who leave Federal employment to be employed by tribal organizations pursuant to the Indian Self-Determination and Education Assistance Act,"Amended by: EO 12107, December 28, 1978;      EO 12608, September 9, 1987",11899,""
41 FR 4879, ,"","","",Presidential Document,Executive Order,02/03/1976,1976-02-02,"",Membership of the Economic Policy Board,"Amends: EO 11808, September 30, 1974
Revoked by EO 11975, March 7, 1977",11903,""
41 FR 5625, ,"","","",Presidential Document,Executive Order,02/09/1976,1976-02-06,"",Establishing the Defense Superior Service Medal,"",11904,""
41 FR 8758, ,"","","",Presidential Document,Executive Order,02/27/1976,1976-02-26,"",Amending the Generalized System of Preferences,"Amends: EO 11888, November 24, 1975
See: EO 11934, August 30, 1976; EO      11960, January 19, 1977; EO 12041, February      25, 1978",11906,""
41 FR 9085, ,"","","",Presidential Document,Executive Order,03/03/1976,1976-03-01,"",Relating to the administration of the Export Administration Act of 1969,"Amends: EO 11533, June 4, 1970
Revoked by: EO 12002, July 7, 1977
See: EO 11940, September 30, 1976",11907,""
41 FR 11805, ,"","","",Presidential Document,Executive Order,03/22/1976,1976-03-18,"","Amending Executive Order No. 11861, as amended, placing certain positions in levels IV and V of the Executive Schedule","Amends: EO 11861, May 21, 1975",11908,""
41 FR 15825, ,"","","",Presidential Document,Executive Order,04/15/1976,1976-04-13,"",Delegation of authorities relating to energy policy and conservation,"Amended by: EO 12003, July 20, 1977;      EO 12038, February 3, 1978; EO      12148, July 20, 1979; EO 12375, August      4, 1982
Superseded or revoked in part by: EO 12919,      June 3, 1994
See: EO 11930, July 30, 1976",11912,""
41 FR 17871, ,"","","",Presidential Document,Executive Order,04/29/1976,1976-04-28,"",Nondiscrimination with respect to the handicapped in Federally assisted programs,"Revoked by: EO 12250, November 2, 1980",11914,""
41 FR 19195, ,"","","",Presidential Document,Executive Order,05/11/1976,1976-05-10,"",Abolishing the Energy Research and Development Advisory Council,"Amends: EO 11827, January 4, 1975
Superseded by: EO 11948, December 20, 1976",11915,""
41 FR 22329, ,"","","",Presidential Document,Executive Order,06/03/1976,1976-06-01,"",Compensation for damages involving nuclear reactors of United States warships,"",11918,""
41 FR 23663, ,"","","",Presidential Document,Executive Order,06/11/1976,1976-06-09,"","Delegating authority of the President to concur in designations of Commissioners, United States Parole Commission","",11919,""
41 FR 23665, ,"","","",Presidential Document,Executive Order,06/11/1976,1976-06-10,"",Establishing executive branch procedures solely for the purpose of facilitating Presidential review of decisions submitted to the President by the Civil Aeronautics Board,"Revoked by: EO 12547, February 6, 1986",11920,""
41 FR 24294, ,"","","",Presidential Document,Executive Order,06/15/1976,1976-06-11,"",Adjusting emergency preparedness assignments to organizational and functional changes in Federal departments and agencies,"Amends: EO 11490, October 28, 1969
Amended by: EO 12046, March 27, 1978
Supersedes: EO 11522, April 6, 1970; EO      11556, September 4, 1970 (in part); EO 11746,      November 7, 1973
See: EO 11953, January 7, 1977; Pub.      L. 94-412 (90 Stat. 1255, 50 U.S.C. 1601)",11921,""
41 FR 24573, ,"","","",Presidential Document,Executive Order,06/17/1976,1976-06-16,"","Amending Executive Order No. 11077 of January 22, 1963, entitled ""Administration of the Migration and Refugee Assistance Act of 1962""","Amends: EO 11077, January 22, 1963",11922,""
41 FR 24689, ,"","","",Presidential Document,Executive Order,06/18/1976,1976-06-17,"","The Honorable Francis E. Meloy, Jr. and Robert O. Waring","",11923,""
41 FR 26847, ,"","","",Presidential Document,Executive Order,06/30/1976,1976-06-29,"",Exemption of Arthur S. Flemming from mandatory retirement,"See: EO 11869, June 24, 1975; EO      12000, June 29, 1977",11924,""
41 FR 30583, ,"","","",Presidential Document,Executive Order,07/26/1976,1976-07-22,"","Amending Executive Order No. 11861, as amended, placing certain positions in levels IV and V of the Executive Schedule","Amends: EO 11861, May 21, 1975
Revoked by: EO 12076, August 18, 1978",11927,""
41 FR 31157, ,"","","",Presidential Document,Executive Order,07/27/1976,1976-07-26,"",Exemption of Harold Council from mandatory retirement,"",11928,""
41 FR 31159, ,"","","",Presidential Document,Executive Order,07/27/1976,1976-07-26,"",Incentive pay for enlisted members of the Uniformed Services who are involuntarily removed from aerial flight duties,"Amends: EO 11157, June 22, 1964",11929,""
41 FR 32399, ,"","","",Presidential Document,Executive Order,08/03/1976,1976-07-30,"",Performance by the Federal Energy Office of energy functions of the Federal Energy Administration,"Revoked by: EO 11933, August 25, 1976",11930,""
41 FR 32691, ,"","","",Presidential Document,Executive Order,08/05/1976,1976-08-04,"",Classification of certain information and material obtained from advisory bodies created to implement the international energy program,"",11932,""
41 FR 36641, ,"","","",Presidential Document,Executive Order,08/31/1976,1976-08-25,"",Termination of the Federal Energy Office,"Revokes: EO 11930, July 30, 1976",11933,""
41 FR 37084, ,"","","",Presidential Document,Executive Order,09/01/1976,1976-08-30,"",Amending the Generalized System of Preferences,"Amends: EO 11888, November 24, 1975
See: EO 11906, February 26, 1976; EO      11960, January 19, 1977; EO 12041, February      25, 1978",11934,""
41 FR 43383, ,"","","",Presidential Document,Executive Order,10/01/1976,1976-09-29,"",Relating to adjustment of cost of living allowances and post deferentials,"Amends: EO 10000, September 16, 1948
Amended by: EO 12107, December 28, 1978",11938,""
41 FR 43889, ,"","","",Presidential Document,Executive Order,10/05/1976,1976-10-01,"",Adjustments of certain rates of pay and allowances,"Supersedes: EO 11883, October 6, 1975
Amended by: EO 11943, October 25, 1976
Superseded by: EO 12010, September      28, 1977",11941,""
41 FR 47213, ,"","","",Presidential Document,Executive Order,10/28/1976,1976-10-25,"",Amendment of adjustments of certain rates of pay and allowances,"Amends: EO 11941, October 1, 1976
Superseded by: EO 12010, September      28, 1977",11943,""
41 FR 47215, ,"","","",Presidential Document,Executive Order,10/28/1976,1976-10-25,"",Authorizing delegation of authority to the Secretary of the Treasury with respect to the Northern Mariana Islands,"Amends: EO 11021, May 7, 1962",11944,""
41 FR 47219, ,"","","",Presidential Document,Executive Order,10/28/1976,1976-10-25,"",White House fellowships,"Amends: EO 11183, October 3, 1964",11946,""
41 FR 55705, ,"","","",Presidential Document,Executive Order,12/22/1976,1976-12-20,"",Continuance of certain Federal advisory committees,"Revokes: EO 11667, April 19, 1972; EO      11809, September 30, 1974; EO 11860, May      19, 1975; EO 11868, June 19, 1975; EO      11873, July 21, 1975; EO 11936, September 8, 1976
Supersedes: EO 11827, January 4, 1975
Continues certain committees established by: EO      11126, November 1, 1963; EO 11145, March      7, 1964; EO 11183, October 3, 1964; EO      11287, June 28, 1966; EO 11342, April      10, 1967; EO 11415, June 24, 1968; EO      11472, May 29, 1969; EO 11562, September      25, 1970; EO 11583, February 24, 1971; EO      11625, October 13, 1971; EO 11753, December      20, 1973; EO 11776, March 28, 1974;      EO 11807, September 28, 1974
Superseded in part by: EO 12007,      August 22, 1977; EO 12029, December      14, 1977
Superseded by: EO 12110, December 28, 1978
See: EO 11915, May 10, 1976",11948,""
42 FR 1453, ,"","","",Presidential Document,Executive Order,01/07/1977,1977-01-06,"",Relating to the Arrangement Regarding International Trade in Textiles,"Amends: EO 11651, March 3, 1972",11951,""
"42 FR 2293, 4809 (corrected)", ,"","","",Presidential Document,Executive Order,01/11/1977,1977-01-07,"",Conforming the Foreign Service and Civil Service Retirement and Disability Systems,"Revoked by: EO 12145, July 18, 1979",11952,""
42 FR 2499, ,"","","",Presidential Document,Executive Order,01/12/1977,1977-01-10,"",Permitting certain qualified employees of the National Aeronautics and Space Administration to be given career or career-conditional appointments,"Amended by: EO 12107, December 28, 1978",11955,""
42 FR 4321, ,"","","",Presidential Document,Executive Order,01/24/1977,1977-01-19,"",Administration of the International Investment Survey Act of 1976,"Amended by: EO 12013, October 7,      1977; EO 12318, August 21, 1981; EO      12518, June 3, 1985",11961,""
42 FR 4323, ,"","","",Presidential Document,Executive Order,01/24/1977,1977-01-19,"",Establishing the President's Advisory Board on International Investment,"Revoked by: EO 12007, August 22,      1977",11962,""
42 FR 4329, ,"","","",Presidential Document,Executive Order,01/24/1977,1977-01-19,"",Establishing the Humanitarian Service Medal,"Amended by: EO 13286, February 28, 2003",11965,""
42 FR 4331, ,"","","",Presidential Document,Executive Order,01/24/1977,1977-01-19,"","Designating certain public international organizations entitled to enjoy certain privileges, exemptions, and immunities","Revokes: EO 11718, May 14, 1973",11966,""
39 FR 29567, ,"","","",Presidential Document,Executive Order,08/16/1974,1974-08-14,"","Revoking Executive Order No. 11796 of July 30, 1974, and continuing in effect Executive Order No. 11533 of June 4, 1970, relating to the administration of export controls","Revokes: EO 11796, July 30, 1974
Continues in effect EO 11533, July 30, 1974
Revoked by: EO 12002, July 7, 1977
See: EO 11818, November 5, 1974; EO      11940, September 30, 1976",11798,""
39 FR 30101, ,"","","",Presidential Document,Executive Order,08/21/1974,1974-08-17,"",Amending Executive Order No. 11554 as it relates to the establishment of a maximum percentage of Navy and Marine Corps officers who may be recommended for promotion from below the appropriate promotion zone,"Amends: EO 11554, August 29, 1970 (which      was revoked by EO 12082, September 19, 1978)
See Pub. L. 94-412 (90 Stat. 1255; 50 U.S.C. 1601)",11799,""
39 FR 30103, ,"","","",Presidential Document,Executive Order,08/21/1974,1974-08-17,"",Delegating certain authority vested in the President by the Aviation Career Incentive Act of 1974,"Amended by: EO 12608, September 9, 1987; EO 13286, February 28, 2003
Revoked by: EO 13294, March 28, 2003",11800,""
39 FR 33299, ,"","","",Presidential Document,Executive Order,09/17/1974,1974-09-16,"",Delegation of certain functions vested in the President to the Director of Selective Service,"See: EO 11878, September 10, 1975",11804,""
39 FR 34261, ,"","","",Presidential Document,Executive Order,09/24/1974,1974-09-20,"",Inspection by President and certain designated employees of the White House Office of Tax Returns made under the Internal Revenue Code of 1954,"Revoked by: EO 12553, February 25, 1986",11805,""
39 FR 35559, ,"","","",Presidential Document,Executive Order,10/02/1974,1974-09-28,"",Occupational safety and health programs for Federal employees,"Supersedes: EO 11612, July 26, 1971
Federal Advisory Council on Occupational Safety and Health continued by:      EO 11827, January 4, 1975; EO      11948, December 20, 1976; EO 12110, December      28, 1978
Revoked by: EO 12196, February 26, 1980",11807,""
39 FR 35563, ,"","","",Presidential Document,Executive Order,10/02/1974,1974-09-30,"","Establishing the President's Economic Policy Board, and for other purposes","Amends: EO 11269, February 14, 1966; EO      11789, June 25, 1974
Amended by: EO 11865, June 16, 1975; EO      11903, February 2, 1976
Revoked in part by: EO 11846, March 27,      1975; EO 11975, March 7, 1977",11808,""
