citation,document_number,end_page,html_url,pdf_url,type,subtype,publication_date,signing_date,start_page,title,disposition_notes,executive_order_number,not_received_for_publication
54 FR 42285, ,"","","",Presidential Document,Executive Order,10/13/1989,1989-10-11,"",Amending Executive Order No. 12345,"Amends: EO 12345, February 2, 1982",12694,""
54 FR 47507, ,"","","",Presidential Document,Executive Order,11/15/1989,1989-11-13,"",President's Drug Advisory Council,"Amended by: EO 12756, March 18, 1991
Revoked by: EO 12869, September       30, 1993",12696,""
54 FR 53037, ,"","","",Presidential Document,Executive Order,12/27/1989,1989-12-22,"",Extending the National Commission on Superconductivity,"Amends: EO 12661, December 27, 1988",12697,""
55 FR 835, ,"","","",Presidential Document,Executive Order,01/09/1990,1990-01-05,"",Seismic safety of Federal and Federally assisted or regulated new building construction,"Amended by: EO 13286, February 28, 2003
Revoked by: EO 13717, February 2, 2016",12699,""
55 FR 2219, ,"","","",Presidential Document,Executive Order,01/23/1990,1990-01-19,"",President's Council of Advisors on Science and Technology,"Amended by: EO 12768, June 28, 1991; EO      12869, September 30, 1993
Revoked by: EO 12882, November 23,      1993",12700,""
55 FR 6969, ,"","","",Presidential Document,Executive Order,02/28/1990,1990-02-26,"","Amendments to Executive Order Nos. 11830, 12367, 12692","Amends: EO 11830, January 9, 1975; EO      12367, June 15, 1982; EO 12692, September      29, 1989",12704,""
55 FR 21831, ,"","","",Presidential Document,Executive Order,05/29/1990,1990-05-24,"",Extending the National Commission on Superconductivity,"Amends: EO 12661, December 27, 1988
See: EO 12774, September 27, 1991",12716,""
55 FR 25295, ,"","","",Presidential Document,Executive Order,06/20/1990,1990-06-18,"",Revoking Executive Order No. 12691,"Revokes: EO 12691, September 23, 1989",12717,""
55 FR 29337, ,"","","",Presidential Document,Executive Order,07/18/1990,1990-07-16,"",President's Council on Rural America,"Amends: EO 12783, December 17, 1991
Revoked by: EO 12869, September      30, 1993",12720,""
55 FR 31349, ,"","","",Presidential Document,Executive Order,08/01/1990,1990-07-30,"",Eligibility of overseas employees for noncompetitive appointments,"Revokes: EO 12362, May 12, 1982; EO      12585, March 3, 1987
See: 5 CFR 8.2; EO 13054, July 7, 1997;      EO 13062, September 29, 1997",12721,""
55 FR 31803, ,"","","",Presidential Document,Executive Order,08/03/1990,1990-08-02,"",Blocking Iraqi government property and prohibiting transactions with Iraq,"See: EO 12724, August 9, 1990; EO      12743, January 18, 1991; Notice, July 26, 1991; Notice, July 21, 1992;      EO 12817, October 21, 1992; Notice, July 20,      1993; Notice, July 19, 1994; Notice, July 28, 1995; Notice, July 22, 1996;      Notice of July 31, 1997; Notice of July 20, 1999; Notice of July 28, 2000;      Notice of July 31, 2001; Notice of July 31, 2002; EO 13303, May 22, 2003; Notice of July 31, 2003; Notice of May 19, 2005; Notice of May 18, 2006
Revoked by: EO 13350, July 29, 2004",12722,""
55 FR 31805, ,"","","",Presidential Document,Executive Order,08/03/1990,1990-08-02,"",Blocking Kuwaiti Government Property,"Revoked by: EO 12771, July 25, 1991
See: EO 12725, August 9, 1990; 55 FR 49856",12723,""
55 FR 33089, ,"","","",Presidential Document,Executive Order,08/13/1990,1990-08-09,"",Blocking Iraqi Government property and prohibiting transactions with Iraq,"See: EO 12722, August 2, 1990; EO      12734, November 14, 1990; Notice, July 26, 1991; Notice, July 21, 1992;      EO 12817, October 21, 1992; Notice, July 20,      1993; Notice of July 19, 1994; Notice of July 28, 1995; Notice of July 22,      1996; Notice of July 31, 1997; Notice of July 20, 1999; Notice of July 28,      2000; Notice of July 31, 2001; Notice of July 31, 2002; EO 13303, May 22, 2003; Notice of July 31, 2003; Notice of May 19, 2005; Notice of May 18, 2006
Revoked by: EO 13350, July 29, 2004",12724,""
55 FR 35027, ,"","","",Presidential Document,Executive Order,08/27/1990,1990-08-22,"",Ordering the Selected Reserve of the Armed Forces to active duty,"Amended by: EO 13286, February 28, 2003
See: EO 12733, November 13, 1990",12727,""
55 FR 35029, ,"","","",Presidential Document,Executive Order,08/27/1990,1990-08-22,"","Delegating the President's authority to suspend any provision of law relating to the promotion, retirement, or separation of members of the Armed Forces","Amended by: EO 13286, February 28, 2003",12728,""
55 FR 42547, ,"","","",Presidential Document,Executive Order,10/19/1990,1990-10-17,"",Principles of ethical conduct for Government officers and employees,"Amends: EO 12674 (modifies in its entirety)
See: 57 FR 35006; 57 FR 58399",12731,""
55 FR 47837, ,"","","",Presidential Document,Executive Order,11/15/1990,1990-11-13,"",Authorizing the extension of the period of active duty of personnel of the Selected Reserve of the Armed Forces,"Amended by: EO 13286, February 28, 2003
See: EO 12727, August 22, 1990",12733,""
55 FR 48587, ,"","","",Presidential Document,Executive Order,11/20/1990,1990-11-16,"",Chemical and biological weapons proliferation,"Amended by: Notice, November 14, 1991; Notice, November 11, 1992; Notice, November 12, 1993
Revoked by: EO 12938, November 14, 1994
See: EO 12868, September 30, 1993; EO 12867, September 30, 1993; EO 12923, June 30, 1994; EO 12924, August 19, 1994; EO 13222, August 17, 2001; EO 13382, June 28, 2005",12735,""
55 FR 51681, ,"","","",Presidential Document,Executive Order,12/14/1990,1990-12-12,"",President's Commission on Environmental Quality,"Revoked by: EO 12852, June 29, 1993",12737,""
55 FR 52033, ,"","","",Presidential Document,Executive Order,12/18/1990,1990-12-14,"",Administration of foreign assistance and related functions and arms export controls,"Amends: EO 11958, January 18, 1977;      EO 12163, September 29, 1979",12738,""
56 FR 1079, ,"","","",Presidential Document,Executive Order,01/10/1991,1991-01-08,"",National security industrial responsiveness,"Amended by: EO 13286, February 28, 2003",12742,""
56 FR 2835, ,"","","",Presidential Document,Executive Order,01/25/1991,1991-01-22,"",Waiver under the Trade Act of 1974 with respect to Bulgaria,"",12745,""
56 FR 2837, ,"","","",Presidential Document,Executive Order,01/25/1991,1991-01-23,"",Waiver under the Trade Act of 1974 with respect to Mongolia,"",12746,""
56 FR 3391, ,"","","",Presidential Document,Executive Order,01/29/1991,1991-01-25,"",National Nutrition Monitoring Advisory Council,"",12747,""
56 FR 8255, ,"","","",Presidential Document,Executive Order,02/27/1991,1991-02-25,"","Implementation of the Agricultural Trade Development and Assistance Act of 1954, as amended, and the Food for Progress Act of 1985, as amended","Revokes: EO 12220, June 27, 1980; EO      12583, February 19, 1987
Amended by: EO 13044, April 18, 1997
See: Memorandum of March 11, 2003 (68 FR 12569)",12752,""
56 FR 10501, ,"","","",Presidential Document,Executive Order,03/12/1991,1991-03-08,"",Nuclear Cooperation With EURATOM,"Supersedes: EO 12706, March 9, 1990
Superseded by: EO 12791, March 9, 1992",12753,""
56 FR 11055, ,"","","",Presidential Document,Executive Order,03/15/1991,1991-03-12,"",Establishing the Southwest Asia Service Medal,"Amended by: EO 12790, March 3, 1992",12754,""
56 FR 11057, ,"","","",Presidential Document,Executive Order,03/15/1991,1991-03-12,"",Administration of Export Controls,"Amends: EO 12002, July 7, 1977
See: EO 12923, June 30, 1994; EO      12924, August 19, 1994; EO 13222,      August 17, 2001",12755,""
56 FR 12107, ,"","","",Presidential Document,Executive Order,03/21/1991,1991-03-19,"",Implementation of the Enterprise for the Americas Initiative,"Amended by: EO 12823, December 3, 1992;      EO 13028, December 3, 1996; EO      13131, July 22, 1999
Revoked by: EO 13345, July 8, 2004",12757,""
56 FR 14631, ,"","","",Presidential Document,Executive Order,04/10/1991,1991-04-05,"",Addition to level IV of the Executive Schedule,"Amends: EO 12154, September 4, 1979",12758,""
56 FR 23645, ,"","","",Presidential Document,Executive Order,05/23/1991,1991-05-21,"",Establishment of the President's Environment and Conservation Challenge Awards,"",12761,""
56 FR 26587, ,"","","",Presidential Document,Executive Order,06/07/1991,1991-06-05,"",Federal Salary Council,"",12764,""
56 FR 27401, ,"","","",Presidential Document,Executive Order,06/13/1991,1991-06-11,"",Delegation of certain defense related authorities of the President to the Secretary of Defense,"",12765,""
56 FR 28463, ,"","","",Presidential Document,Executive Order,06/20/1991,1991-06-18,"",European Bank for Reconstruction and Development and European Space Agency,"Amends: EO 11269, February 14, 1966; EO      11760, January 11, 1974",12766,""
56 FR 30284, ,"","","",Presidential Document,Executive Order,07/01/1991,1991-06-27,"","Amendments to the Manual for Courts-Martial, United States, 1984","Amends: EO 12473, April 13, 1984
See: EO 12484, July 13, 1984; EO      12550, February 19, 1986; EO 12586, March      3, 1987; EO 12708, March 23, 1990; EO      12888, December 23, 1993; EO 12936, November      10, 1994; EO 12960, May 12, 1995; EO      13086, May 27, 1998; EO 13140, October      6, 1999",12767,""
56 FR 31855, ,"","","",Presidential Document,Executive Order,07/12/1991,1991-07-10,"",Implementation of section 311(a) of the Comprehensive Anti-Apartheid Act,"Revokes: EO 12532, September 9, 1985; EO      12535, October 1, 1985
See: EO 12571, October 27, 1986; 56 FR 32056;      56 FR 38335; 57 FR 4553",12769,""
56 FR 35801, ,"","","",Presidential Document,Executive Order,07/29/1991,1991-07-25,"",Metric usage in Federal Government programs,"",12770,""
56 FR 35993, ,"","","",Presidential Document,Executive Order,07/29/1991,1991-07-25,"",Revoking earlier orders with respect to Kuwait,"Revokes: EO 12723, August 2, 1990; EO      12725, August 9, 1990",12771,""
56 FR 41621, ,"","","",Presidential Document,Executive Order,08/22/1991,1991-08-17,"",Waiver under the Trade Act of 1974 with respect to Romania,"",12772,""
56 FR 50641, ,"","","",Presidential Document,Executive Order,10/07/1991,1991-10-04,"",Prohibiting Certain transactions with respect to Haiti,"Amended by (continued): Notice of September 30, 1992; Notice of September 30, 1994
Revoked in part by: EO 12779, October 28, 1991; EO      12853, June 30, 1993
Revoked by: EO 12932, October 14, 1994
See: EO 12872, October 18, 1993;      Notice of September 30, 1993; EO 12872,      October 18, 1993; EO 12914, May 7, 1994; EO      12917, May 21, 1994; EO 12920, June 10,      1994; EO 12922, June 21, 1994; 59 FR 51066",12775,""
56 FR 51315, ,"","","",Presidential Document,Executive Order,10/10/1991,1991-10-08,"",Extending the National Defense Service Medal to members of the Reserve components of the Armed Forces of the United States During the period of the Persian Gulf crisis,"Amended by: EO 13293, March 28, 2003",12776,""
56 FR 67451, ,"","","",Presidential Document,Executive Order,12/30/1991,1991-12-26,"",Extending the President's Education Policy Advisory Committee,"Amends: EO 12687, August 15, 1989",12785,""
57 FR 517, ,"","","",Presidential Document,Executive Order,01/07/1992,1991-12-31,"",The order of succession of officers to act as Secretary of Defense,"Revokes: EO 12514, May 14, 1985
Revoked by: EO 13000 of April 24, 1996",12787,""
57 FR 5225, ,"","","",Presidential Document,Executive Order,02/12/1992,1992-02-10,"",Delegation of reporting functions under the Immigration Reform and Control Act of 1986,"Amended by: EO 13286, February 28, 2003",12789,""
57 FR 8057, ,"","","",Presidential Document,Executive Order,03/05/1992,1992-03-03,"",Amending the Order Establishing the Southwest Asia Service Medal,"Amends: EO 12754, March 12, 1991",12790,""
57 FR 9165, ,"","","",Presidential Document,Executive Order,03/16/1992,1992-03-12,"",National Commission on America's Urban Families,"Amended by: EO 12827, December 30, 1992
Revoked by: EO 12869, September      30, 1993",12792,""
57 FR 14321, ,"","","",Presidential Document,Executive Order,04/20/1992,1992-04-16,"","Waiver Under the Trade Act of 1974 with respect to the Republic of Byelarus, the Republic of Kyrgyzstan, and the Russian Federation","",12802,""
57 FR 24347, ,"","","",Presidential Document,Executive Order,06/09/1992,1992-06-05,"",Blocking property of and prohibiting transactions with the Federal Republic of Yugoslavia (Serbia and Montenegro),"Amended by (continued): Notice, May 25, 1993; Notice, May 25, 1994; Notice, May 24, 1996; Notice, May 28, 1997
Revoked in part by: EO 12831, January      15, 1993
See: EO 12846, April 25, 1993; Final      Rule of January 3, 1996 (61 FR 629); Presidential Determination No. 96-7      of December 27, 1995; Notice of May 25, 2000; Notice of May 24, 2001
Revoked by: EO 13304, May 28, 2003",12810,""
57 FR 28585, ,"","","",Presidential Document,Executive Order,06/26/1992,1992-06-24,"",Waiver Under the Trade Act of 1974 With Respect to Tajikistan and Turkmenistan,"",12811,""
57 FR 32879, ,"","","",Presidential Document,Executive Order,07/24/1992,1992-07-22,"",Declassification and Release of Materials Pertaining to Prisoners of War and Missing in Action,"",12812,""
57 FR 34851, ,"","","",Presidential Document,Executive Order,08/07/1992,1992-08-04,"",President's Commission on Management of the Agency for International Development (AID) Programs,"Amended by: EO 12815, September 30, 1992
Revoked by: EO 12869, September      30, 1993",12813,""
57 FR 53429, ,"","","",Presidential Document,Executive Order,11/09/1992,1992-11-05,"",Facilitating Federal Employees' Participation in Community Service Activities,"Revoked by: EO 13401, April 27, 2006",12820,""
57 FR 54285, ,"","","",Presidential Document,Executive Order,11/18/1992,1992-11-16,"",Improving Mathematics and Science Education in Support of the National Education Goals,"Superseded by EO 12999 of April 17, 1996",12821,""
57 FR 54289, ,"","","",Presidential Document,Executive Order,11/18/1992,1992-11-16,"",Providing for Payment of Separate Maintenance Allowances to Employees Assigned to Johnston Island,"Amends: EO 11609, July 22, 1971",12822,""
57 FR 60973, ,"","","",Presidential Document,Executive Order,12/22/1992,1992-12-18,"","Half-Day Closing of Executive Departments and Agencies of the Federal Government on Thursday, December 24, 1992","",12825,false
58 FR 4061, ,"","","",Presidential Document,Executive Order,01/13/1993,1993-01-09,"",Establishing the Military Outstanding Volunteer Service Medal,"Amended by: EO 13286, February 28, 2003",12830,""
58 FR 5253, ,"","","",Presidential Document,Executive Order,01/21/1993,1993-01-15,"",Additional Measures With Respect to the Federal Republic of Yugoslavia (Serbia and Montenegro),"Revokes in part: EO 12810, June 5, 1992
Amended by: (continued by) Notice, May 25, 1993; Notice, May 25, 1994; Notice, May 24, 1996; Notice May 28, 1997
See: EO 12808, May 30, 1992; EO 12846, April 25, 1993; Presidential Determination No. 96-7 of December 27, 1995; Notice of May 25, 2000; Notice of May 24, 2001
Revoked by: EO 13304, May 28, 2003",12831,""
