citation,document_number,end_page,html_url,pdf_url,type,subtype,publication_date,signing_date,start_page,title,disposition_notes,executive_order_number,not_received_for_publication
54 FR 7753, ,"","","",Presidential Document,Executive Order,02/23/1989,1989-02-20,"",Organization of Eastern Caribbean States,"",12669,""
54 FR 12571, ,"","","",Presidential Document,Executive Order,03/28/1989,1989-03-23,"",Delegation of disaster relief and emergency assistance functions,"Amends: EO 12148, July 20, 1979; EO       11795, July 11, 1974",12673,""
54 FR 15159, ,"","","",Presidential Document,Executive Order,04/14/1989,1989-04-12,"",Principles of ethical conduct for Government officers and employees,"Revokes: EO 11222, May 8, 1965; EO       12565, September 25, 1986
Amended by: EO 12731, October 17, 1990 (modified       in its entirety)
See: 57 FR 35006; 57 FR 58399",12674,""
54 FR 18872, ,"","","",Presidential Document,Executive Order,05/02/1989,1989-04-28,"",Level IV of the Executive Schedule,"Amends: EO 12154, September 4, 1979",12678,""
54 FR 27149, ,"","","",Presidential Document,Executive Order,06/27/1989,1989-06-23,"",Level IV of the Executive Schedule,"Amends: EO 12154, September 4, 1979",12679,""
54 FR 28995, ,"","","",Presidential Document,Executive Order,07/10/1989,1989-07-05,"",Administration of foreign assistance and related functions and arms export controls,"Amends: EO 11958, January 18, 1977;       EO 12163, September 29, 1979",12680,""
54 FR 31162, ,"","","",Presidential Document,Executive Order,07/26/1989,1989-07-21,"",Prescribing regulations relating to certain travel time of members of the Uniformed Services called to active duty,"Amends: EO 10153, August 17, 1950",12683,""
54 FR 34131, ,"","","",Presidential Document,Executive Order,08/18/1989,1989-08-16,"",Debarment and Suspension,"See: EO 12549, February 18, 1986",12689,""
54 FR 40627, ,"","","",Presidential Document,Executive Order,10/03/1989,1989-09-29,"",Continuance of Certain Federal Advisory Committees,"Continues committees established by: EO 12190,       February 1, 1980; EO 11145, March 7, 1964;       EO 12196, February 26, 1980; EO       11183, October 3, 1964, EO 12367, June       15, 1982; EO 12216, June 18, 1980; EO       11776, March 28, 1974; EO 11287, June       28, 1966; EO 12345, February 2, 1982; EO       12131, May 4, 1979; EO 12382, September       13, 1982; EO 12704, February 26, 1990
Revokes: EO 12462, February 17, 1984; EO       12592, April 10, 1987; EO 12668, January 25, 1989;       EO 12607, September 2, 1987; EO       12296, March 2, 1981; EO 12528, August       8, 1985; EO 12601, June 24, 1987
Supersedes: EO 12610, September 30, 1987
Superseded by: EO 12774, September 27, 1991",12692,""
54 FR 46589, ,"","","",Presidential Document,Executive Order,11/03/1989,1989-11-01,"",Delegation of Debt Relief Authority,"",12695,""
54 FR 53473, ,"","","",Presidential Document,Executive Order,12/28/1989,1989-12-23,"",Adjustments of certain rates of pay and allowances,"Supersedes: EO 12663, January 6,       1989
Superseded by: EO 12736, December 12, 1990",12698,""
55 FR 5953, ,"","","",Presidential Document,Executive Order,02/20/1990,1990-02-14,"",Amending Executive Order No. 12334,"Amends: EO 12334, December 4, 1981",12701,""
55 FR 6231, ,"","","",Presidential Document,Executive Order,02/22/1990,1990-02-20,"",Waiver under the Trade Act of 1974 with respect to Czechoslovakia,"",12702,""
55 FR 6351, ,"","","",Presidential Document,Executive Order,02/23/1990,1990-02-20,"",Support for East European Democracy (SEED) Program,"Amended by: EO 13118, March 31, 1999",12703,""
55 FR 8113, ,"","","",Presidential Document,Executive Order,03/06/1990,1990-03-03,"",Amendment to Executive Order No. 12686,"Amends: EO 12686, August 4, 1989",12705,""
55 FR 9313, ,"","","",Presidential Document,Executive Order,03/13/1990,1990-03-09,"",Nuclear Cooperation With EURATOM,"Supersedes: EO 12670, March 9, 1989
Superseded by: EO 12753, March 8, 1991
See: EO 12791, March 9, 1992",12706,""
55 FR 9707, ,"","","",Presidential Document,Executive Order,03/14/1990,1990-03-13,"",Termination of emergency with respect to Nicaragua,"Revokes: EO 12513, May 1, 1985",12707,""
55 FR 11353, ,"","","",Presidential Document,Executive Order,03/27/1990,1990-03-23,"","Amendments to the Manual for Courts-Martial, United States, 1984","Amends: EO 12473, April 13, 1984
See: EO 12767, June 27, 1991; EO      12888, December 23, 1993; EO 12936, November      10, 1994; EO 12960, May 12, 1995; EO      13086, May 27, 1998; EO 13140, October      6, 1999",12708,""
55 FR 13097, ,"","","",Presidential Document,Executive Order,04/06/1990,1990-04-04,"",Increasing the membership of the President's Council on Physical Fitness and Sports,"Amends: EO 12345, February 2, 1982",12709,""
55 FR 13099, ,"","","",Presidential Document,Executive Order,04/06/1990,1990-04-05,"",Termination of emergency with respect to Panama,"Revokes: EO 12635, April 8, 1988
See: 59 FR 46720; 59 FR 55209",12710,""
55 FR 13897, ,"","","",Presidential Document,Executive Order,04/13/1990,1990-04-11,"",Policy implementation with respect to nationals of the People's Republic of China,See: Pub. L. 102-393 (106 Stat. 17766); Pub. L. 102-404 (106 Stat. 1969),12711,""
55 FR 18095, ,"","","",Presidential Document,Executive Order,05/01/1990,1990-04-26,"",Adding the Secretary of Energy to the National Space Council,"Amends: EO 12675, April 20, 1989",12712,""
55 FR 18719, ,"","","",Presidential Document,Executive Order,05/04/1990,1990-05-01,"",Report required by section 502 of the Automotive Products Trade Act of 1965,"",12713,""
55 FR 19047, ,"","","",Presidential Document,Executive Order,05/08/1990,1990-05-03,"",Establishing an emergency board to investigate disputes between certain railroads represented by the National Carriers' Conference Committee of the National Railway Labor Conference and their employees represented by certain labor organizations,"",12714,""
55 FR 19051, ,"","","",Presidential Document,Executive Order,05/08/1990,1990-05-03,"","Determination under section 2606 of Title 10, United States Code, for support of scouting activities overseas","",12715,""
55 FR 27451, ,"","","",Presidential Document,Executive Order,07/03/1990,1990-06-29,"",President's Advisory Commission on the Public Service,"",12718,""
55 FR 29001, ,"","","",Presidential Document,Executive Order,07/17/1990,1990-07-11,"",President's Commission on the Federal Appointment Process,"",12719,""
55 FR 33091, ,"","","",Presidential Document,Executive Order,08/13/1990,1990-08-09,"",Blocking Kuwaiti Government property and prohibiting transactions with Kuwait,"Revoked by: EO 12771, July 25, 1991
See: EO 12723, August 2, 1990; 55 FR 49856",12725,""
55 FR 33637, ,"","","",Presidential Document,Executive Order,08/16/1990,1990-08-15,"",Waiver under the Trade Act of 1974 with respect to the German Democratic Republic,"See: Presidential Determination 90-31, August 17, 1990; Presidential Determination 90-30; August 15, 1990",12726,""
55 FR 39389, ,"","","",Presidential Document,Executive Order,09/26/1990,1990-09-24,"",Educational Excellence for Hispanic Americans,"Revoked by: EO 12900, February 22, 1994",12729,""
55 FR 40373, ,"","","",Presidential Document,Executive Order,10/02/1990,1990-09-30,"",Continuation of export control regulations,"Amended by: Notice, September 26, 1991; Notice, September 25, 1992;
Revoked by: EO 12867, September      30, 1993
See: EO 12002, July 7, 1977; EO      12214, May 2, 1980; EO 12131, May 4, 1979;      EO 12868, September 30, 1993",12730,""
55 FR 46489, ,"","","",Presidential Document,Executive Order,11/02/1990,1990-10-31,"",International Fund for Agricultural Development,"",12732,""
55 FR 48099, ,"","","",Presidential Document,Executive Order,11/19/1990,1990-11-14,"",National emergency construction authority,"See: EO 12722, August 2, 1990; EO 12724, August 9, 1990
Revoked by: EO 13350, July 29, 2004",12734,""
55 FR 51385, ,"","","",Presidential Document,Executive Order,12/14/1990,1990-12-12,"",Adjustments of certain rates of pay and allowances,"Supersedes: EO 12698, December 23,      1989
Superseded by: EO 12786, December 26, 1991",12736,""
55 FR 52165, ,"","","",Presidential Document,Executive Order,12/19/1990,1990-12-17,"","Half-day closing of Government departments and agencies on Monday, December 24, 1990","",12739,""
56 FR 355, ,"","","",Presidential Document,Executive Order,01/04/1991,1990-12-29,"",Waiver under the Trade Act of 1974 with respect to the Soviet Union,"",12740,""
56 FR 475, ,"","","",Presidential Document,Executive Order,01/04/1991,1990-12-31,"",Extending the President's Education Policy Advisory Committee,"",12741,""
56 FR 2661, ,"","","",Presidential Document,Executive Order,01/23/1991,1991-01-18,"",Ordering the Ready Reserve of the Armed Forces to active duty,"Amended by: EO 13286, February 28, 2003
Revoked by: EO 13350, July 29, 2004",12743,""
56 FR 2663, ,"","","",Presidential Document,Executive Order,01/23/1991,1991-01-21,"","Designation of Arabian Peninsula areas, airspace, and adjacent waters as a combat zone","",12744,""
56 FR 4521, ,"","","",Presidential Document,Executive Order,02/04/1991,1991-02-01,"",Providing for Federal Pay Administration,"Amends: EO 10982, December 25, 1961
Revokes: EO 11721, May 23, 1973
Amended by: EO 12883, November 29,      1993; EO 13106, December 7, 1998
Revoked in pary by: EO 13415, December 1, 2006
See: EO 12764, June 5, 1991",12748,""
56 FR 4711, ,"","","",Presidential Document,Executive Order,02/06/1991,1991-02-04,"",Additions to level IV of the Executive Schedule,"Amends: EO 12154, September 4, 1979",12749,""
56 FR 6785, ,"","","",Presidential Document,Executive Order,02/19/1991,1991-02-14,"","Designation of Arabian Peninsula areas, airspace, and adjacent waters as the Persian Gulf Desert Shield Area","",12750,""
56 FR 6787, ,"","","",Presidential Document,Executive Order,02/19/1991,1991-02-14,"",Health care services for Operation Desert Storm,"Revoked by: EO 13350, July 29, 2004",12751,""
56 FR 11903, ,"","","",Presidential Document,Executive Order,03/20/1991,1991-03-18,"",Continuance of the President's Drug Advisory Council,"",12756,""
56 FR 16257, ,"","","",Presidential Document,Executive Order,04/19/1991,1991-04-17,"",Federal energy management,"Revoked by: EO 12902, March 8, 1994; EO      13123, June 3, 1999",12759,""
56 FR 21062, ,"","","",Presidential Document,Executive Order,05/06/1991,1991-05-02,"",President's Commission on Executive Exchange,"Revokes: EO 12493, December 5, 1984",12760,""
56 FR 25993, ,"","","",Presidential Document,Executive Order,06/06/1991,1991-06-04,"",Amendment relating to basic allowance for quarters,"Amends: EO 11157, June 22, 1964",12762,""
56 FR 25994, ,"","","",Presidential Document,Executive Order,06/06/1991,1991-06-04,"",Facilitating the operation of the Advisory Commission on Conferences in Ocean Shipping,"",12763,""
56 FR 30302, ,"","","",Presidential Document,Executive Order,07/02/1991,1991-06-28,"",Extension of the President's Council of Advisors on Science and Technology,"Amends: EO 12700, January 19, 1990
Revoked by: EO 12882, November 23,      1993",12768,""
56 FR 49387, ,"","","",Presidential Document,Executive Order,09/30/1991,1991-09-26,"",Amending Executive Order No. 10480,"Amends: EO 10480, August 14,      1953
Revoked in part by: EO 12919, June 3, 1994
Superseded by: EO 12919, June 3, 1994",12773,""
56 FR 49835, ,"","","",Presidential Document,Executive Order,10/01/1991,1991-09-27,"",Continuance of certain Federal advisory committees,"Continues certain committee established by: EO      11145, March 7, 1964; EO 11183, October      3, 1964; EO 11287, October 24, 1964; EO      11776, March 28, 1974; EO 12131, May 4,      1979; EO 12196, February 26, 1980; EO      12216, June 18, 1980; EO 12345, February      2, 1982; EO 12367, June 15, 1982; EO      12382, September 13, 1982
Revokes: EO 12658, November 18, 1988 ; EO      12686, August 4, 1989
Revokes in part: EO 12661, December 27,      1988
Supersedes: EO 12692, September 29,      1989
Superseded by: EO 12869, September      30, 1993",12774,""
56 FR 54757, ,"","","",Presidential Document,Executive Order,10/22/1991,1991-10-18,"","Implementation of section 311 of the Federal Water Pollution Control Act of October 18, 1972, as amended, and the Oil Pollution Act of 1990","Amends: EO 12580, January 23, 1987
Amended by: EO 13286, February 28, 2003; EO 13638, March 15, 2013
Revokes: EO 11735, August 3, 1973; EO      12123, February 26, 1979; EO 12418, May      5, 1983; Memorandum of August 24, 1990
See: 56 FR 54612; EO 13626, September 10, 2012",12777,""
56 FR 55195, ,"","","",Presidential Document,Executive Order,10/25/1991,1991-10-23,"",Civil Justice Reform,"Revoked by: EO 12988 of February 5, 1996
See: 57 FR 3640",12778,""
56 FR 55975, ,"","","",Presidential Document,Executive Order,10/30/1991,1991-10-28,"",Prohibiting certain transactions with respect to Haiti,"Revokes in part: EO 12775, October 4, 1991
Amended by (continued): Notice of September 30, 1992; Notice of September 30, 1994
Revoked in part by: EO 12853, June      30, 1993; EO 12917, May 21, 1994
Revoked by: EO 12932, October 14, 1994
See: Notice of September 30, 1993; EO      12872, October 18, 1993; EO 12914, May      7, 1994; EO 12920, June 10, 1994; EO      12922, June 21, 1994; 59 FR 51066",12779,""
56 FR 56289, ,"","","",Presidential Document,Executive Order,11/04/1991,1991-10-31,"",Federal agency recycling and the Council on Federal Recycling and Procurement Policy,"Revoked by: EO 12873, October 20,      1993",12780,""
56 FR 59203, ,"","","",Presidential Document,Executive Order,11/22/1991,1991-11-20,"","Delegation of functions and authorities, development of requirements and regulations, and correction of title","Amends: EO 854, June 26, 1908
Revokes: EO 11339, March 28, 1967",12781,""
56 FR 59847, ,"","","",Presidential Document,Executive Order,11/25/1991,1991-11-21,"",Amending Executive Order No. 12594,"Amends: EO 12594, April 28, 1987",12782,""
56 FR 65977, ,"","","",Presidential Document,Executive Order,12/19/1991,1991-12-17,"",Extending the President's Council on Rural America,"Amends: EO 12720, July 16, 1990",12783,""
56 FR 66339, ,"","","",Presidential Document,Executive Order,12/23/1991,1991-12-19,"",Delegation of authority regarding the naval petroleum and oil shale reserves,"See: EO 12929, September 29, 1994",12784,""
56 FR 67453, ,"","","",Presidential Document,Executive Order,12/30/1991,1991-12-26,"",Adjustments of certain rates of pay and allowances,"Supersedes: EO 12736, December 12, 1990
Superseded by: EO 12826, December 30, 1992",12786,""
57 FR 2213, ,"","","",Presidential Document,Executive Order,01/21/1992,1992-01-15,"",Defense Economic Adjustment Program,"Amended by: EO 13286, February 28, 2003; EO 13378, May 12, 2005
Supersedes: EO 12049, March 27, 1978",12788,""
57 FR 8717, ,"","","",Presidential Document,Executive Order,03/11/1992,1992-03-09,"",Nuclear Cooperation With EURATOM,"Supersedes: EO 12753, March 8, 1991
Superseded by: EO 12840, March 9,      1993",12791,""
57 FR 10281, ,"","","",Presidential Document,Executive Order,03/25/1992,1992-03-20,"",Continuing the Presidential Service Certificate and the Presidential Service Badge,"Amended by: EO 13286, February 28, 2003
Supersedes: EO 10879, June 1, 1960",12793,""
57 FR 11417, ,"","","",Presidential Document,Executive Order,04/02/1992,1992-03-31,"",Establishing an emergency board to investigate disputes between certain railroads and their employees represented by the International Association of Machinists and Aerospace Workers,"",12794,""
57 FR 11421, ,"","","",Presidential Document,Executive Order,04/02/1992,1992-03-31,"",Establishing an emergency board to investigate a dispute between the Consolidated Rail Corporation and its employees represented by the Brotherhood of Maintenance of Way Employees,"",12795,""
57 FR 11423, ,"","","",Presidential Document,Executive Order,04/02/1992,1992-03-31,"",Establishing an emergency board to investigate disputes between the National Railroad Passenger Corporation and its employees represented by certain labor organizations,"",12796,""
57 FR 11671, ,"","","",Presidential Document,Executive Order,04/07/1992,1992-04-03,"",Review of increases in rates of basic pay for certain employees of the Department of Veterans Affairs and other agencies,"Revokes: EO 12438, August 23, 1983",12797,""
57 FR 12175, ,"","","",Presidential Document,Executive Order,04/08/1992,1992-04-06,"",Waiver under the Trade Act of 1974 with respect to Armenia,"",12798,""
57 FR 12401, ,"","","",Presidential Document,Executive Order,04/09/1992,1992-04-07,"",Navy and Marine Corps Reserve Officer Promotions,"",12799,""
57 FR 12985, ,"","","",Presidential Document,Executive Order,04/14/1992,1992-04-13,"",Notification of employee rights concerning payment of union dues or fees,"Revoked by: EO 12836, February 1,      1993
See: EO 13201, February 17, 2001",12800,""
57 FR 14319, ,"","","",Presidential Document,Executive Order,04/17/1992,1992-04-15,"","Barring overflight, takeoff, and landing of aircraft flying to or from Libya","Revoked by: EO 13357, September 20, 2004",12801,""
57 FR 19063, ,"","","",Presidential Document,Executive Order,05/04/1992,1992-04-30,"",Infrastructure Privatization,"",12803,""
57 FR 19361, ,"","","",Presidential Document,Executive Order,05/05/1992,1992-05-01,"","Providing for the restoration of law and order in the city and county of Los Angeles, and other districts of California","",12804,""
57 FR 20627, ,"","","",Presidential Document,Executive Order,05/14/1992,1992-05-11,"",Integrity and Efficiency in Federal Programs,"Revokes: EO 12625, January 27, 1988
See EO 12993, March 21, 1996",12805,""
57 FR 21589, ,"","","",Presidential Document,Executive Order,05/21/1992,1992-05-19,"",Establishment of a Fetal Tissue Bank,Revoked by: Pub.L. 103-43 (107 Stat. 133),12806,""
57 FR 23133, ,"","","",Presidential Document,Executive Order,06/01/1992,1992-05-24,"",Interdiction of illegal aliens,"Amended by: EO 13286, February 28, 2003
Revokes: EO 12324, September 29,      1981",12807,""
57 FR 23299, ,"","","",Presidential Document,Executive Order,06/02/1992,1992-05-30,"",Blocking Yugoslav Government Property and Property of the Governments of Serbia and Montenegro,"Amended by (continued): Notice, May 25, 1993; Notice, May 25, 1994; Notice May 24, 1996 Notice, May 28, 1997
See: EO 12381, January 15, 1993; EO      12846, April 25, 1993; EO 12934, October      25, 1994; Presidential Determination No. 96-7 of December 27, 1995; Notice      of May 25, 2000; Notice of May 24, 2001
Revoked by: EO 13304, May 28, 2003",12808,""
57 FR 23925, ,"","","",Presidential Document,Executive Order,06/05/1992,1992-06-03,"","Waiver Under the Trade Act of 1974 With Respect to Albania, Azerbaijan, Georgia, Kazakhstan, Moldova, Ukraine, and Uzbekistan","",12809,""
57 FR 42483, ,"","","",Presidential Document,Executive Order,09/14/1992,1992-09-10,"",Additions to level IV of the Executive Schedule for members of the Chemical Safety and Hazard Investigation Board,"",12814,""
57 FR 45709, ,"","","",Presidential Document,Executive Order,10/05/1992,1992-09-30,"",Extending the President's Commission on Management of the Agency for International Development (AID) Programs,"Amends: EO 12813, August 4, 1992",12815,""
57 FR 47562, ,"","","",Presidential Document,Executive Order,10/19/1992,1992-10-14,"",Management Improvement in the Federal Government,"Revokes: EO 12479, May 24, 1984
Revoked by: EO 13048, June 10, 1997",12816,""
57 FR 48433, ,"","","",Presidential Document,Executive Order,10/23/1992,1992-10-21,"",Transfer of Certain Iraqi Government Assets Held by Domestic Banks,"Revoked by: EO 13350, July 29, 2004",12817,""
57 FR 48713, ,"","","",Presidential Document,Executive Order,10/28/1992,1992-10-23,"",Open Bidding on Federal and Federally Funded Construction Projects,"Revoked by: EO 12836, February 1,      1993
See: EO 13202, February 17, 2001",12818,""
57 FR 49369, ,"","","",Presidential Document,Executive Order,10/30/1992,1992-10-28,"",Establishing a Presidential Youth Award for Community Service,"",12819,""
57 FR 57645, ,"","","",Presidential Document,Executive Order,12/07/1992,1992-12-03,"",Amendments to Executive Order No. 12757 - Implementation of the Enterprise for the Americas Initiative,"Amends: EO 12757, March 19, 1991
See: EO 13028, December 3, 1996; EO      13131, July 22, 1999
Revoked by: EO 13345, July 8, 2004",12823,""
57 FR 58121, ,"","","",Presidential Document,Executive Order,12/09/1992,1992-12-07,"",Establishing the Transportation Distinguished Service Medal,"Amended by: EO 13286, February 28, 2003; EO 13569, April 5, 2011",12824,""
57 FR 62909, ,"","","",Presidential Document,Executive Order,12/31/1992,1992-12-30,"",Adjustments of certain rates of pay and allowances,"Supersedes: EO 12786, December 26, 1991
Superseded in part by: EO 12886,      December 23, 1993
Superseded by: EO 12944, December 28, 1994
See: Memorandum, December 1, 1993; 59 FR 2216",12826,""
58 FR 211, ,"","","",Presidential Document,Executive Order,01/04/1993,1992-12-30,"",Amendment to Executive Order No. 12792,"Amends: EO 12792, March 12, 1992",12827,""
58 FR 2965, ,"","","",Presidential Document,Executive Order,01/07/1993,1993-01-05,"",Delegation of Certain Personnel Management Authorities,"Revoked in part by: EO 13415, December 1, 2006",12828,""
58 FR 5905, ,"","","",Presidential Document,Executive Order,01/22/1993,1993-01-19,"",Amendments Relating to the National Research Council,"Amends: EO 2859, May 11, 1918",12832,""
58 FR 5907, ,"","","",Presidential Document,Executive Order,01/22/1993,1993-01-19,"",Addition to Level V of the Executive Schedule: Transition Manager for the United States Enrichment Corporation,"Amends: EO 12154, September 4, 1979
See: EO 12841, March 9, 1993",12833,""
58 FR 3479, ,"","","",Presidential Document,Executive Order,01/08/1993,1993-01-06,"",National Industrial Security Program,"Amends: EO 10865, February 20, 1960
Amended by: EO 12885, December 14, 1993; EO 13708, September 30, 2015
Continued by: EO 13652;  September 30, 2013; EO 14354, September 29, 2025 
See: EO 10909, January 17, 1961; EO 11382, November 27, 1967; EO 12333, December 8, 1981; EO 12356, April 2, 1992; EO 13284, January 23, 2003; EO 13467, June 30, 2008; EO 13549, August 18, 2010; EO 13585, September 30, 2011",12829,false
54 FR 3979, ,"","","",Presidential Document,Executive Order,01/27/1989,1989-01-25,"",President's Commission on Federal Ethics Law Reform,"Revoked by: EO 12692, September 29, 1989",12668,""
54 FR 10267, ,"","","",Presidential Document,Executive Order,03/13/1989,1989-03-09,"",Nuclear Cooperation Wth EURATOM,"Superseded by: EO 12706, March 9, 1990
See: EO 12753, March 8, 1991; EO       12791, March 9, 1992",12670,""
54 FR 11157, ,"","","",Presidential Document,Executive Order,03/17/1989,1989-03-14,"",Exclusion of the Customs Office of Enforcement from the Federal Labor-Management Relations Program,"Amends: EO 12171, November 19, 1979",12671,""
54 FR 12167, ,"","","",Presidential Document,Executive Order,03/23/1989,1989-03-21,"",Interagency Committee on Handicapped Employees,"Amends: EO 11830, January 9, 1975",12672,""
54 FR 17691, ,"","","",Presidential Document,Executive Order,04/25/1989,1989-04-20,"",Establishing the National Space Council,"Amends: EO 12660, December 20, 1988; EO       12712, April 26, 1990
Revoked in part by: EO 12869, September       30, 1993",12675,""
54 FR 18639, ,"","","",Presidential Document,Executive Order,05/01/1989,1989-04-26,"",Delegating authority to provide assistance for the Nicaraguan Resistance,"Revokes: EO 12654, October 7, 1988",12676,""
54 FR 18869, ,"","","",Presidential Document,Executive Order,05/02/1989,1989-04-28,"",Historically black colleges and universities,"Revokes: EO 12320, September 15,       1981",12677,""
54 FR 28997, ,"","","",Presidential Document,Executive Order,07/10/1989,1989-07-06,"",Exclusions From the Federal Labor-Management Relations Program,"Amends: EO 12171, November 19, 1979",12681,""
54 FR 29315, ,"","","",Presidential Document,Executive Order,07/11/1989,1989-07-07,"",Commission on Alternative Utilization of Military Facilities,"",12682,""
54 FR 31643, ,"","","",Presidential Document,Executive Order,07/31/1989,1989-07-27,"",Conforming the Central Intelligence Agency and Civil Service Retirement and Disability Systems,"",12684,""
54 FR 31796, ,"","","",Presidential Document,Executive Order,08/01/1989,1989-07-28,"",Noncompetitive conversion of personal assistants to employees with disabilities,"",12685,""
54 FR 32629, ,"","","",Presidential Document,Executive Order,08/09/1989,1989-08-04,"",President's Commission on Aviation Security and Terrorism,"Amended by: EO 12705, March 3, 1990
Revoked by: EO 12774, September 27, 1991",12686,""
54 FR 34127, ,"","","",Presidential Document,Executive Order,08/18/1989,1989-08-15,"",President's Education Policy Advisory Committee,"Amended by: EO 12741, December 31, 1990;       EO 12785, December 26, 1991
Revoked by: EO 12869, September       30, 1993",12687,""
54 FR 34129, ,"","","",Presidential Document,Executive Order,08/18/1989,1989-08-15,"","Transfer of Authority Choctawhatchee National Forest, Florida","See: EO 10355, May 26, 1952",12688,""
54 FR 39153, ,"","","",Presidential Document,Executive Order,09/22/1989,1989-09-20,"",Providing for the restoration of law and order in the Virgin Islands,"See: Proc. 6023, September 20, 1989",12690,""
54 FR 39719, ,"","","",Presidential Document,Executive Order,09/27/1989,1989-09-23,"",President's Advisory Committee on the Points of Light Initiative Foundation,"Revoked by: EO 12717, June 18, 1990",12691,""
54 FR 40629, ,"","","",Presidential Document,Executive Order,10/03/1989,1989-09-29,"",Exclusion of the Defense Mapping Agency Reston Center and Elements under the Joint Special Operations Command from the Federal Labor-Management Relations Program,"Amends: EO 12171, November 19, 1979",12693,""
